="",代码,名称,开盘涨幅,当日涨幅,近10日最高涨幅,近10日涨幅,琅琊飙升榜,琅琊排行榜(当日),琅琊排行榜(次日),首次封板,最后封板,当日价格,攻击波,回头波,次日开盘涨幅,次日涨幅,开板数,封单量,当日换手,最新五星买卖点,最新红黄白买卖点,最新神秘C点买卖点,最新智能亮点,几天几板,所属题材,涨停原因,流通市值,总市值
="",="600633",浙数文化,-2.29%,9.92%,16.94%,10.81%,-16,="1",="17",13:39:24,14:57:03,7.20,14.10%,-0.14%,-2.78%,-2.22%,="4",84手,6.44%,买入: 10天,---,---,估值合理, 0天0板,智慧城市 | 手机游戏 | 电子竞技 | 体育产业 | 互联网医疗 | 大数据 | 网络游戏 | 人工智能 | 阿里巴巴概念 | 云计算 | 汇金 | 融资融券 | 区块链 | 独角兽概念 | 网络直播 | 杭州亚运会 | 高商誉 | 分拆上市意愿 | 数据中心 | 共同富裕示范区 | NFT,淘宝618将上线元宇宙购物；元宇宙共识大会召开在即。公司已试水推出数字艺术品交易，相关产品已在公司拍卖平台成交并完成交割，成交作品均有对应的合约地址及NFT ID，为公司范围内首批成交的数字艺术品,91.13亿,91.13亿
="",="600622",光大嘉宝,0.00%,9.60%,2.22%,-11.08%,-25,="2",="27",14:49:30,14:49:30,4.11,11.99%,-0.48%,-2.92%,-4.62%,="1",1066手,10.52%,卖出: 12天,卖出: 12天,卖出: 19天,MTM金叉 估值合理, 0天0板,融资融券 | 小金属概念 | 标普道琼斯A股 | 物业管理 | 统一大市场,首套房贷款利率下限调整。Ａ股市场唯一以房地产投资信托基金（REITs）为主营业务的上市公司,61.64亿,61.64亿
="",="600312",平高电气,0.45%,9.24%,17.35%,13.24%,-8,="3",="11",14:46:44,14:46:44,7.33,9.08%,-0.68%,-2.59%,-1.50%,="1",8820手,3.24%,买入: 10天,---,---,估值合理, 0天0板,一带一路 | 充电桩 | 特高压 | 智能电网 | 融资融券 | 标普道琼斯A股,国家能源局要求加快推进一批输变电重点工程规划建设工作，今明两年将核准12条特高压工程。国际领先的电气开关龙头，国内三大高压开关设备研发、制造基地之一,99.46亿,99.46亿
="",="600062",华润双鹤,-2.53%,8.77%,14.40%,-24.79%,-1,="4",="5",11:11:55,14:56:18,31.00,14.81%,-1.12%,0.00%,3.16%,="3",53手,10.64%,卖出: 3天,卖出: 3天,卖出: 3天,估值合理, 0天0板,沪股通 | 汇金 | 融资融券 | MSCI概念 | 青蒿素 | 仿制药一致性评价 | 标普道琼斯A股 | 流感 | 新冠治疗,公司与真实生物签署《战略合作协议》及《阿兹夫定片委托加工生产框架协议》,317.95亿,323.40亿
="",="601595",上海电影,0.33%,8.75%,8.85%,5.10%,-2,="5",="7",13:49:51,14:44:31,9.94,8.63%,-1.09%,0.20%,0.40%,="2",1280手,2.57%,买入: 14天,---,---,---, 0天0板,上海国企改革,公司形成“专业发行+综合院线+高端影院”完整电影发行放映产业链的公司；下属的联和院线是国内成立最早、规模最大的电影院线之一,44.55亿,44.55亿
="",="601126",四方股份,-0.38%,8.72%,22.75%,20.83%,-2,="6",="8",14:39:56,14:39:56,14.22,10.83%,-1.18%,-2.46%,0.07%,="1",1.89万手,6.92%,买入: 19天,卖出: 7天,---,均线多头排列 BIAS金叉 强势股 估值合理, 0天0板,光伏概念 | 军工 | 智能制造 | 特高压 | 智能电网 | 基金重仓 | 融资融券 | 储能,1、公司的产品已成为电力系统继电保护与控制领域的主流产品；
2、储能变流器技术处于行业领先，集中式、链式和模块化三种技术路线并行，覆盖从发电到用电各种储能场景，已在近百个储能项目中实际应用,115.63亿,115.63亿
="",="002654",万润科技,0.29%,8.60%,6.96%,4.46%,-13,="7",="20",13:20:48,14:41:33,3.79,8.60%,-1.30%,-1.58%,-2.90%,="2",214手,4.82%,买入: 13天,---,---,KDJ金叉 BIAS金叉, 0天0板,智慧城市 | 军工 | 参股新三板 | 节能照明 | 大数据 | 智能家居 | 汽车电子 | 独角兽概念 | 回购概念 | 安防 | 华为概念 | 柔性屏 | 抖音 | 年报预增 | ETC | Mini LED | 快手概念,国内中高端LED产品领军企业之一，控股股东拟变更为长江产业集团;,28.97亿,32.41亿
="",="002868",绿康生化,0.00%,8.50%,13.84%,9.23%,-5,="8",="13",09:33:39,09:33:39,12.51,8.50%,-1.34%,-2.48%,-1.68%,="1",868手,4.02%,买入: 12天,卖出: 30天,买入: 1天,KDJ金叉, 0天0板,---,新版兽药GMP验收在即。动物饲料添加剂领域杆菌肽细分龙头，全球少数亚甲基水杨酸杆菌肽通过美国FDA现场审核的企业之一,19.44亿,19.44亿
="",="600166",福田汽车,-1.17%,8.20%,15.63%,12.89%,-19,="9",="28",10:10:53,10:22:50,2.77,9.49%,-1.77%,-3.61%,-5.05%,="2",4.70万手,4.88%,买入: 15天,---,---,小步上扬 强势股, 0天0板,车联网 | 智慧城市 | 军工 | 冬奥会 | 无人驾驶 | 大数据 | 新能源汽车 | 智能交通 | 融资融券 | 燃料电池 | 工业互联网 | 百度概念 | 冷链物流 | 华为概念 | 华为汽车 | 地摊经济,国常会：阶段性减征部分乘用车购置税600亿。公司生产车型涵盖轻型卡车、中型卡车、重型卡车、轻型客车等，新能源整车集成坚持纯电动、混合动力、燃料电池三线并举；上半年净利润同比翻2倍，与中石油合建的首座加氢站投运,182.13亿,182.13亿
="",="600696",岩石股份,-0.84%,8.15%,4.17%,1.05%,-13,="10",="23",11:07:11,13:19:27,28.25,9.50%,-1.67%,-2.37%,-3.47%,="3",387手,2.14%,买入: 12天,---,---,估值较低, 0天0板,壳资源 | 摘帽 | 白酒概念,白酒“新国标”将从6月1日起开始实施，行业准入门槛提高。1、公司拟回购不低于3000万元且不超过4000万元公司股份；
2、酒类业务现为公司核心主业，持有的高酱酒业52%股权，目前高酱酒业主要从事大曲酱香基酒的生产和储存，被授权贴牌生产销售酱香型白酒,94.49亿,94.49亿
="",="601258",庞大集团,2.21%,8.09%,11.11%,2.96%,-18,="11",="29",09:36:27,09:36:27,1.47,6.52%,-2.00%,-2.72%,-5.44%,="1",6592手,3.90%,买入: 14天,买入: 6天,---,BIAS金叉 MA(20日线支撑) 估值高, 0天0板,职业教育 | 京津冀一体化 | 股权转让 | 雄安新区 | MSCI概念 | 汽车销售 | 网约车,国内代理品牌最多的汽车经销商，也是主要的新能源汽车经销服务商,150.34亿,150.34亿
="",="002883",中设股份,-1.30%,7.83%,29.76%,-16.13%,-13,="12",="25",09:33:12,14:50:45,19.14,9.25%,-2.00%,-9.98%,-3.81%,="12",220手,50.69%,卖出: 8天,---,卖出: 2天,机构上榜 机构净买入 多家机构买入 估值较高,12天7板,PPP概念 | 雄安新区 | 资产重组 | 大基建 | 回购概念 | 新型城镇化 | 方舱医院,《关于推进以县城为重要载体的城镇化建设的意见》印发。现代科技型工程咨询企业，业务覆盖交通、市政、建筑、环境等多个领域,18.05亿,24.93亿
="",="002206",海 利 得,0.18%,7.49%,16.39%,5.96%,-3,="13",="16",13:28:42,14:34:21,6.03,8.65%,-2.27%,-2.16%,-3.81%,="2",557手,6.62%,买入: 16天,---,---,北向增仓 估值较低, 0天0板,深股通 | 基金重仓 | 养老金 | 长三角一体化,欧盟计划到2025年将光伏发电能力翻一番。公司新业务涂层材料可用于沙漠光伏铺地反射膜提升光伏能效，目前为国内首家进入该领域，22年有望随着沙漠光伏铺开而迅速放量,57.52亿,73.75亿
="",="000607",华媒控股,-2.48%,7.22%,15.68%,6.18%,-1,="14",="15",13:44:03,13:47:03,4.75,9.95%,-2.46%,-3.16%,-1.89%,="2",2552手,8.20%,买入: 8天,---,---,MA(20日线支撑) 估值高, 0天0板,职业教育 | 三胎概念 | 创投 | 在线教育 | 阿里巴巴概念 | 融资融券 | 区块链 | 知识产权保护 | 杭州亚运会 | 抖音 | 快手概念 | NFT | 托育服务,中办、国办印发《关于推进实施国家文化数字化战略的意见》。杭州日报社旗下，大文创产业生态运营商，公司为杭州文化产权交易所第一大股东,42.03亿,48.34亿
="",="002234",民和股份,0.82%,7.21%,13.62%,10.28%,="3",="15",="12",13:47:36,13:47:36,15.77,7.72%,-2.53%,-1.71%,-1.52%,="1",811手,9.08%,买入: 23天,---,---,---, 0天0板,生态农业 | 基金重仓 | 融资融券 | 养鸡,公司是中国最大的父母代肉种鸡笼养企业,39.91亿,55.03亿
="",="002813",路畅科技,0.25%,7.16%,11.08%,10.84%,-8,="16",="24",13:20:45,13:20:45,25.89,9.01%,-2.60%,-1.00%,-3.63%,="1",701手,5.08%,买入: 16天,买入: 18天,---,强势股, 0天0板,车联网 | 无人驾驶 | 百度概念 | 胎压监测,中联重科预定要约收购公司23.83%股份，要约价格为21.67元/股,30.55亿,31.07亿
="",="603919",金徽酒,1.19%,7.03%,19.62%,11.18%,="15",="17",="2",14:03:23,14:03:53,31.36,6.78%,-2.70%,0.16%,7.14%,="2",297手,2.57%,买入: 22天,买入: 5天,---,北向增仓 估值合理, 0天0板,沪股通 | 融资融券 | 白酒概念,蓝筹股集体反弹，多只行业龙头回踩年线，贵州茅台企稳。公司为甘肃浓香型白酒龙头，复星集团称将和甘肃省、陇南市携手把金徽酒做大做强,159.08亿,159.08亿
="",="600536",中国软件,3.94%,6.56%,6.64%,3.26%,-1,="18",="19",09:31:06,09:38:57,39.98,2.51%,-3.13%,-2.20%,-2.83%,="2",1344手,5.18%,买入: 18天,---,---,MA(20日线支撑) 估值较低, 0天0板,信息安全 | 智慧城市 | 中字头股票 | 云计算 | 国产软件 | 融资融券 | MSCI概念 | 国产操作系统 | 腾讯概念 | 标普道琼斯A股 | 数字经济 | 电子身份证,港股联想脉冲上涨；信创产业加速发展。公司拥有完整的从操作系统等基础软件、中间件、安全产品到应用系统的业务链条，参股的麒麟软件在政务内网份额高,197.73亿,202.97亿
="",="603786",科博达,-0.91%,6.40%,28.05%,25.81%,="1",="19",="18",14:44:43,14:45:13,55.84,12.58%,-3.27%,1.06%,-2.33%,="2",9手,7.68%,买入: 83天,买入: 6天,---,均线多头排列 BIAS金叉 强势股 北向增仓 估值较高, 0天0板,沪股通 | 新能源汽车 | 汽车电子 | 基金重仓 | 新进指数 | 新能源车零部件 | 外资重仓 | 专精特新,乘用车购置税减免；下游车企加速复工复产。公司是汽车控制器领域龙头，国内少有的进入全球高端客户供应体系的零部件企业,22.39亿,223.42亿
="",="603136",天目湖,-1.10%,6.21%,26.09%,12.05%,="17",="20",="3",13:52:20,13:52:20,25.13,8.41%,-3.46%,-1.03%,4.34%,="1",310手,6.46%,卖出: 11天,买入: 5天,卖出: 12天,均线多头排列 估值高, 0天0板,基金重仓,疫后行业复苏预期；多个大使馆调整健康码申请。公司地处长三角，为区域旅游龙头，天目湖旅游度假区是国家5A级旅游景区,46.82亿,46.82亿
="",="601975",招商南油,0.00%,5.65%,25.00%,16.44%,="11",="21",="10",09:38:52,09:53:01,3.18,6.71%,-3.93%,-0.94%,-1.26%,="3",8.12万手,13.73%,买入: 20天,买入: 19天,买入: 2天,估值高, 0天0板,融资融券,公司为原长航油运重新恢复上市，招商局集团旗下从事油轮运输的专业公司,154.32亿,154.32亿
="",="600386",北巴传媒,1.11%,5.57%,26.15%,19.25%,="18",="22",="4",09:38:51,09:38:51,3.79,4.70%,-4.05%,-1.06%,4.22%,="1",9895手,3.63%,买入: 9天,买入: 5天,---,量能巨变 估值较低, 0天0板,充电桩 | 新能源汽车 | 智能交通 | 智能停车 | 融资融券 | 独角兽概念 | 汽车销售 | 汽车拆解,国常会：阶段性减征部分乘用车购置税600亿。旗下隆瑞三优已有125处充电站，711个公交充电桩和24个社会充电桩投入运营，主要为控股股东北京公交集团6378辆纯电动公交车和部分社会新能源车辆提供充电服务,30.56亿,30.56亿
="",="001288",运机集团,3.45%,5.38%,6.76%,-2.81%,-3,="23",="26",09:38:39,09:38:39,15.28,8.37%,-4.20%,0.07%,-4.32%,="1",390手,22.96%,卖出: 7天,---,买入: 6天,MTM金叉 看涨吞没 强势股 估值高, 0天0板,一带一路 | 次新股 | 核准制次新股 | 中俄贸易,公司专注于输送机械装备领域，专业从事以带式输送机为主的节能环保型输送机械成套设备的研产销，是物料输送系统解决方案的供应商,6.11亿,24.45亿
="",="003039",顺控发展,0.70%,4.90%,36.33%,14.36%,="18",="24",="6",09:39:12,09:39:12,22.50,7.04%,-4.66%,-2.22%,2.22%,="1",1266手,25.06%,卖出: 13天,卖出: 3天,卖出: 4天,北向增仓 估值较低, 4天2板,深股通 | 环保 | 融资融券 | 绿色电力,《关于推进以县城为重要载体的城镇化建设的意见》印发。前期次新股龙头；公司主营业务为自来水制售、供排水管网工程和垃圾焚烧发电，拥有顺德区供水特许经营权,27.57亿,138.94亿
="",="600135",乐凯胶片,1.36%,4.84%,17.25%,11.04%,="16",="25",="9",09:33:49,09:33:49,6.93,4.68%,-4.68%,-1.01%,-1.01%,="1",981手,3.12%,买入: 11天,买入: 4天,---,估值较高, 0天0板,光伏概念 | 京津冀一体化 | 锂电池 | 融资融券 | 雄安新区 | 医疗器械概念 | 柔性屏 | 年报预增,比亚迪新车销量火爆；斯诺威锂矿控股权争夺激烈，成交价超20亿。公司锂电涂层隔膜生产线扩建项目完成设备安装、调试、化工试车，将正式投入使用，9月份计划进行小批量生产,29.64亿,38.34亿
="",="002073",软控股份,0.58%,4.63%,8.16%,4.74%,="4",="26",="22",09:42:12,09:42:54,5.42,4.63%,-4.91%,-1.66%,-3.14%,="2",9172手,7.07%,买入: 14天,---,---,KDJ金叉 强势股 估值较低, 0天0板,智能制造 | 工业4.0 | 环保 | 新材料概念 | 汇金 | 融资融券 | 工业互联网 | 宁德时代概念 | 知识产权保护,软件龙头诚迈科技五连板；数字经济“互联网+”相关政策将出台，首届数字中国建设峰会将于4月22日至24日在福州海峡国际会展中心举行，是中国规模最大的国家级信息化会议。国内轮胎橡胶装备与系统龙头，为轮胎企业提供软硬结合、管控一体的智能化整体解决方案；前三季度净利润同比翻近3倍,50.62亿,51.68亿
="",="603725",天安新材,-1.52%,4.57%,11.42%,3.24%,="13",="27",="14",09:59:56,09:59:56,6.86,6.19%,-4.99%,0.00%,-1.75%,="1",30手,5.24%,买入: 10天,---,---,BIAS金叉 MA(20日线支撑) 强势股, 0天0板,创投 | 新能源汽车 | 新材料概念 | 资产重组 | 装配式建筑 | 专精特新,乘用车购置税减免；下游车企加速复工复产。公司专业从事高分子复合饰面材料的研产销，其中环保TPO汽饰材料应用于小鹏汽车P7系列车型；拟推2021年限制性股票激励计划,14.09亿,14.37亿
="",="603658",安图生物,-0.19%,3.92%,9.10%,-0.67%,="7",="28",="21",13:00:05,13:00:05,44.30,4.98%,-5.52%,-1.35%,-3.09%,="1",30手,1.27%,卖出: 12天,---,---,KDJ金叉 RSI金叉 估值较低, 0天0板,沪股通 | 体外诊断 | 融资融券 | MSCI概念 | 新进指数 | 医疗器械概念 | 标普道琼斯A股 | 新冠检测 | 幽门螺旋杆菌,欧美多国爆发猴痘病例。1、公司猴痘病毒核酸检测试剂盒（PCR-荧光探针法）产品获欧盟CE准入；
2、公司已取得新型冠状病毒（2019-nCoV）IgM抗体检测试剂盒（磁微粒化学发光法）和新型冠状病毒（2019-nCoV）IgG抗体检测试剂盒（磁微粒化学发光法）的《医疗器械注册证》,259.72亿,259.72亿
="",="000756",新华制药,-5.51%,2.87%,47.09%,4.88%,="28",="29",="1",14:14:57,14:14:57,31.90,14.09%,-6.48%,1.82%,10.00%,="1",19手,27.91%,卖出: 26天,买入: 10天,卖出: 2天,估值较高,23天16板(8个一字板),深股通 | 山东国企改革 | 医药电商 | 阿里巴巴概念 | 新零售 | 仿制药一致性评价 | 标普道琼斯A股 | 网红经济 | 辅助生殖 | 医美 | 幽门螺旋杆菌 | 新冠治疗,新三板创新层挂牌企业君实生物在发行境内创新药企业第一单私募双创可转债，也是境内至今规模最大的私募可转债。公司与河南真实生物科技有限公司签署《战略合作协议》，真实生物同意新华制药为其拥有的阿兹夫定等产品在中国及经双方同意的其他国家的产品生产商和经销商,139.19亿,213.61亿
T,="002363",隆基机械,5.56%,2.85%,20.36%,-1.31%,-1,="30",="31",09:30:06,09:30:06,6.85,7.03%,-6.55%,-9.93%,-9.93%,="1",1428手,19.73%,卖出: 5天,卖出: 5天,---,BIAS金叉 MA(20日线支撑) 估值较高, 0天0板,军工 | 工业4.0 | 新能源汽车 | 特斯拉 | 新能源车零部件,习主席博鳌论坛称，将放宽汽车外资股比限制和降低进口车关税。公司为国内规模最大、产品型号最多的汽车制动部件生产企业之一,28.48亿,28.50亿
="",="002943",宇晶股份,0.11%,0.33%,20.02%,6.03%,="1",="31",="30",09:59:54,10:21:36,46.30,5.76%,-8.80%,-2.81%,-8.66%,="2",2945手,35.67%,卖出: 3天,卖出: 5天,卖出: 5天,RSI金叉 MTM金叉 强势股 估值较高, 0天0板,光伏概念 | 智能制造 | 稀土永磁 | 基金重仓 | 券商重仓 | 年报预增 | 工业母机,欧盟计划到2025年将光伏发电能力翻一番。券商给出超高目标价；公司硬脆材料加工设备龙头，掌握切片设备+金刚线+工艺，布局HJT专用硅,31.06亿,46.30亿
